file_name,utterance,context,sarcasm
1_6211.wav,"No. You mean this was all a ruse? Oh, how could I be so stu...","[""Oh, no! I can't!"", ""Hurry! \nWe're running out of time!"", '- Okay.', 'Just do it!', 'Oh, God!\nOne... two...\nthree!', 'Trick or treat, bubbeleh.', 'What?\n(laughing)']",False
1_6221.wav,"Well, if you don't mind looking like an orange traffic cone, great.","['So, Bernadette, how goes the hunt for bridesmaid dresses?']",True
1_6355.wav,"said horrible things about each other in public... all in all, a pretty magical night.","['Okay. So... we went out, saw a movie, met some nice people,']",True
1_6370.wav,"Oh, of course he is. She's very interesting. Did you know, when she was 14, she severed the webbing between her own toes?","['consider changing disciplines.\nYeah, to the humanities-- perhaps history.', ""One of the advantages of teaching history is that you don't have to create things."", 'You know, you just have to remember stuff that happened and then parrot it back.', 'You could have fun with that.', ""Yeah, that's not it."", ""Stuart's kind of interested in Amy.""]",True
1_6426.wav,"You know, the holidays are just around the corner. Maybe he wants to see if he can lodge the other testicle up there.","['No, that was a different, different guy.', 'Was he the one who used your head to open a nut?', 'Oh, oh, oh.', 'Was he the one who made you eat your arm hair?', ""No, but, actually, that was this guy's sister."", 'All right, well, what do you think he wants?', ""I don't know.""]",True
1_6427.wav,Hmm. That's too bad. We could have spent New Year's Eve waiting for the ball to drop.,"['Oh, oh, oh.', 'Was he the one who made you eat your arm hair?', ""No, but, actually, that was this guy's sister."", 'All right, well, what do you think he wants?', ""I don't know."", 'You know, the holidays are just around the corner.', 'Maybe he wants to see if he can lodge the other testicle up there.', 'I told you. That was a different guy.']",True
1_6428.wav,Sure. You want to see what all the scientists are wearing this year.,"[""It's 2:00 a.m. What are you doing up?"", 'Nobel Prize acceptance ceremony streaming live from Stockholm.']",True
1_6472.wav,You'd think a winner could make a decent cup of cocoa.,"['Then take away his keys and make him wander the streets with the other drunks.', 'You remember Sheldon and Raj and Howard.', 'Not really, no.', ""It's funny, huh, Leonard?"", ""Back in school, I was the winner and you were the loser.\nAnd now we're reversed."", ""You're the winner.""]",True
1_6504.wav,"Oh, I see why you're confused. No, her news sounded important, but what you're forgetting is, it was an achievement in the field of biology. That's all about yucky, squishy things.","[""It's probably a euphemism for urination."", 'Sheldon, what is wrong with you?', 'Not much. Although, I can be faulted for being overly fond of koala bears.', ""I don't know what it is, when they smart munching on eucalyptus, I just melt inside."", 'Okay, Amy just told you some exciting news, and you acted like it was no big deal.']",True
1_6534.wav,"No, but maybe she wants a man with a pocket watch.","[""I don't think there's anything in this jewelry store that Amy would appreciate more than the humidifier we were just looking at at Sears."", 'Oh, my God, now I know what I sound like to you when I say stupid stuff.', 'Ooh, a pocket watch.', ""Okay, I don't think Amy wants a pocket watch.""]",False
1_6627.wav,"Well, yeah, sex with you is pretty great. Have you ever tried it?","['That was a really nice dinner.', ""I'm glad you asked me out again."", 'Me, too; I missed you.', 'You see me all the time.', ""You sure you just don't miss the sex?""]",False
1_6645.wav,"Well, that wady took high-wes pictures of my junk wast night for Cwaigswist.","['(chimes) Wisten to me.\nNot westauwant; westauwant.', '(chimes) I don\'t know what you mean by ""not westauwant; westauwant.""', 'See? Total cwap.\nYou suck, Siwi.', ""Hey, don't talk to her like that. \nShe's a lady.""]",False
1_6648.wav,You mean for a person whose neck massages feel like an eagle is trying to carry you to its nest?,"['This is amazing.\nHow did you even get this idea?', 'I called your dad.\nI asked him what things you liked to do when you were a kid.', 'This seemed easier than getting a cow out here so you could tip it.', ""Okay, you're kind of really great.""]",True
1_6683.wav,"Yeah, terrific. The other astronauts would love to go hurtling through space with a guy named ""Crash.""","['Buzz Lightyear is not real.', ""No, that's not what I'm talking about."", 'Well, are you talking about when he thought he was real?', 'No', 'Okay, um... how about ""Crash""? \nHoward ""Crash"" Wolowitz.']",True
1_6766.wav,Maybe that's because I'm not being challenged. It's the same reason Einstein failed math.,"[""And I'm super smart, so it's probably true."", ""Hey, I've been training in the field of neurobiology for 12 years."", ""You've been here for three hours, and you've spent one of them in the bathroom."", ""I'm sorry! It takes me a while to get things going on an unfamiliar toilet."", ""Sheldon, I've given you the simplest things to do, and you haven't done one of them right.""]",False
1_6769.wav,"Hope your hands are steady. It's the width of a single hair. But this is just biology, so I'm sure it's no problem for a genius like you.","['All right.', ""I'm no stranger to a little gray matter."", 'Locus coeruleus.', 'Locus coeruleus.', ""You're getting warmer-- it is, indeed, in the brain.""]",True
1_6835.wav,"Oh, screw her. She's just lucky we let her hang out with us.","['The painting is a constant reminder that of the three of us, she is the least cool.', ""Yeah, that's... that's what it is, so..."", 'You have such a good heart.', 'Yeah... I try.', 'Come on.', 'Whoa, whoa, where are we going?', ""We're going to go put this painting back up in your apartment."", 'Well, what about Bernadette?']",False
1_6860.wav,"I'm sorry, it's the bad boy attitude that comes with this hair.","[""You know, Sheldon, I used to cut my brother's hair. \nI could do it for you."", 'Penny, I know you mean well, offering the skills of the hill folk, but, um,', ""here in town, we don't churn our own butter, we don't make dresses out of gunny sacks, and, uh, we sure as shootin' don't get our hair cut by bottle-blonde..."", 'Sheldon, be nice.']",False
1_7047.wav,"Also instead of just living in your mother's house, you could actually live inside her body.","['Wrong. Leonard?', 'Horse, but mostly just for the height.', 'A little bit for the genital girth.', ""Wrong, and let's keep it clean, shall we?"", ""Kangaroo, uh, I'd be Kanga-Jew."", 'The first of my people to dunk a basketball.']",True
1_7082.wav,"...to all the good times we had, like, uh, when we went camping and spent that night telling each other all our secrets. I told him I'm addicted to pedicures and he told me he lost his virginity to his cousin.","['This man became my whole world.', 'Yeah, nice speech, Francine.', ""I'm not done, but thank you."", 'I think back....']",False
1_7089.wav,"How about you? Did you have a fun night? Yeah, we, uh, made gift bags, had wine, and then went online and saw this.","['after you had a snootful of this, laddie!', 'Funny.', 'You boys have a nice time?', 'Yeah, it was great.', 'Low-key, like I promised. \nNo hanky-panky, no strippers.\nJust the guys telling jokes.', ""That's nice.""]",True
1_7186.wav,"Not exactly. Listen, if you don't mind, I'm not really up for chatting. I'm just going to sit here quietly and let my life flash before my eyes.","['and she makes me Froot Loops.', 'Go with gay story, people are more accepting of that.', 'Actually, Froot Loops just got married to a girl.', 'Congratulations.', 'Thanks, we decided to do it before the launch.', 'You and Mrs. Loops have a big wedding?']",False
1_7281.wav,"Darn. If you weren't busy, I'd ask you to join us.","['""Release the Kraken."" That never gets old.', '""Release the Kraken!"" Oh, chills.', ""Besides, I'm having dinner with Amy."", ""Oh, okay. I'll just go home and be alone."", 'W-Which is cool.\nI eat alone, I sleep alone, I cry alone, so...\nCool.']",True
1_7341.wav,I am talking to a man in space. If you don't have the (walkie-talkie static) then he might as well be at the Coffee Bean over on Lake Street.,"['You know, joking, kidding around, hurting feelings.', 'Okay, my turn. \nLet me talk to him.', 'Go ahead.', '2311 North Los Robles Avenue, Pasadena, California to International Space Station.\nCan you read me? Over.', '(imitates walkie-talkie static) Yes, I read you, Sheldon.', 'Copy that. Over. (imitates walkie-talkie static)', 'What are you doing?']",False
1_7357.wav,I'm starting to get a sense of it.,"[""My tongue won't go as far forward as it used to."", 'Maybe your tongue is shrinking.', 'Nope.', 'Oh, you have no idea how annoying this is.']",True
1_7395.wav,"Well, if that's all it takes, it's a good thing you don't have a dog.","['You slept with him?', ""I didn't know what else to do.\nHe had those big, sad eyes."", 'Oh, sure, you had no choice.', 'He looked at me like this.']",True
1_7400.wav,"Of course, it is... it's been in the news. And it's a very famous boson.","['There are some charts in the back where I kept track of shape, color and consistency.', 'Disgusting.', ""No, what's disgusting is he's still keeping track."", 'Why do you need all this stuff...?', 'No, no, no, no... Sorry!', 'I am glad you asked.', 'Yeah, are you familiar with the Higgs boson?']",False
1_7402.wav,I didn't know they gave Nobel prizes for making boom-boom in the potty.,"['the paper was rejected, but recently, he was proven right.', ""And now he's on the fast track to win a Nobel prize."", ""Yeah, that's basically what I said."", 'The point is Higgs is being celebrated for work he did 50 years ago, so that got me thinking,', ""perhaps I've already hit upon the idea that will win me my Nobel prize.""]",True
1_7442.wav,"The original title was ""A Rederivation of Maxwell's Equations Regarding Electromagnetism"""" I dumbed it down because some of the more religious people in town were starting to say I was a witch.","['This will interest you. And, Penny, feel free to paint your nails.', 'What do you got?', 'I believe Alex may have unearthed the grade school science project that could be my ticket to the Nobel Prize.', 'Behold.', '""Magnets: What Do They Stick To?"" If the answer is ""metal,"" it\'s not exactly groundbreaking.']",False
1_7443.wav,We've kind of been involved in a five-year experiment.,"['in town were starting to say I was a witch.', 'Sheldon thinks the approach in this paper might change the way we calculate ferromagnetic hysteresis.', ""Oh, it's about time. I hated the old way."", ""Hi. I'm Penny."", 'Alex.\nUh, do you work with Dr. Hofstadter?', 'In a way.']",False
1_7445.wav,My limbic system wants to take your pants off.,"['Uh, do you work with Dr. Hofstadter?', 'In a way.', ""We've kind of been involved in a five-year experiment."", ""Oh. Well, you're lucky. He seems very talented.\nAnd I'm sure a lot of people want to work with him."", ""Well, a lot of people can't."", 'Uh, hey.', 'Where are we going?']",False
1_7449.wav,"Okay, the NASA Web site says Howard's final descent has begun.","[""or Leonard's gym membership."", ""We're not kicking him out. \nStuart and I have become good friends."", ""Okay, one vote for, one vote against.\nLeonard, you're the tiebreaker."", ""I don't have a problem with Stuart.\nBesides, he gives us a 20% discount at his comic book store."", ""Well, I don't sell my friendship that cheaply."", 'I can go 30.', 'Welcome aboard, old chum.']",False
1_7487.wav,"Yeah, well, Bernadette's a little under the weather and my mom's kind of under my dentist.","['Oh, look at you.\nYou, you look like you grew.', ""Yeah.\nThe lack of gravity did decompress my spine, so I'm like an inch and a half taller."", ""I'm going to the DMV tomorrow to get my license changed before I shrink back."", 'Oh, uh, come in, come in.', ""Oh, I, uh, I didn't think I was going to get to see you until tomorrow.""]",False
1_7490.wav,"It's okay, you know, we space cowboys don't do what we do for glory and fame. We leave that to your rock stars and your athletes and your Howie Mandels.","[""Yeah, well, Bernadette's a little under the weather and my mom's kind of under my dentist."", 'Wait, your, your mother is sleeping with your dentist?', 'Former dentist.\nI need a new one now that I know where his hands have been.', ""So you're wandering all around by yourself?\nThat's not the kind of hero's welcome an astronaut should come home to.""]",False
1_7494.wav,that sounds a little funny to an American ear.,"['Wow, so you guys are like buds now?', 'Oh, yeah, we hang out all the time.', ""Plus, he doesn't have a girlfriend, I don't have a girlfriend."", ""It's like we both had these holes in our lives, but now we fill each other's holes.""]",False
1_7504.wav,"""To Stuart, your comic book store is out of this world. Just like the guy in this picture was.""","['Oh, hey, Stuart, I got you a little souvenir from my trip to space.', ""Well, Howard, that's very nice of you."", 'Yeah, maybe. Open it first.', ""It's my official NASA portrait.""]",False
1_7575.wav,"You're right, the party's fantastic. Please, tell me more. I haven't heard enough about it all week because hearing about that never gets old!","['It was a compromise. I lost.', ""Can you believe Stuart's walking around taking credit for this party?"", 'Who cares?', 'What do you mean ""who cares""? Look at what I pulled off here.\nThe deejay\'s on fire, there\'s a Tardis photo booth in the back room, and, oh, my God, the food!', 'Stuart wanted Kraft Draculoni and cheese.']",True
1_7593.wav,"Amy, I can't just ask Wil Wheaton to leave. He's a minor celebrity. Once you explain who he is, many people recognize him.","['What do you think?', 'Can I speak to you for a second?', ""I'll be right back."", 'Feel free to play with yourself.', ""I don't care for your friend, he's being rude to me."", 'You need to ask him to leave.']",False
1_7641.wav,"She was just so sad all the time. Yeah, I was the only person who could cheer her up. Well, me and Ben and Jerry.","[""You are now the only woman in my life who I'll see naked in the bathroom."", ""I know this wasn't easy.\nYou doing okay?"", ""Oh, I'm fine.\nIt's just her I'm worried about."", ""Aw, she'll be okay.\nShe's a grown woman."", ""I know. \nIt's just ever since my dad left, I've felt responsible for her."", ""That's a lot for a kid to deal with.""]",False
1_7661.wav,"Yeah, that was five weeks ago. How much longer is he gonna milk that cow?","['There it is again.\nDo you kiss your mother with that mouth?', ""Oh, well, I'm sorry for your loss.\n- Oh! - Good night, sir."", ""Unbelievable.\nHe says Wolowitz deserves my spot because he's a high-profile asset to the university."", ""Well, he's not wrong.\nHoward did go to the International Space Station.""]",False
1_7675.wav,"Anyway, to this day, I still can't see a box of crayons without crossing my legs.","['Damn.', ""Well, at least when we do make love, Sheldon won't be thinking about his mother."", ""And yes, that is a cleverly veiled reference to Howard's lifelong obsession to crawl back into her spacious womb.""]",False
1_7722.wav,Exactly what it was half an hour ago. It's like you're not even trying to get better.,['(thermometer beeps) 102.2.\n(coughs)'],True
1_7894.wav,I did. The guy at the liquor store said this stuff tastes great in coffee.,"['Do you really think you should be drinking right now?', 'How else am I supposed to talk to the Human Resources lady?', ""I don't know. Seek professional help?""]",False
1_7938.wav,"Come on, let's just start walking. There's got to be a gas station or something nearby.","['What if we were to get in a car with a crazy person?', ""Look at us, Sheldon.\nWe're the crazy people."", 'Well, perhaps we should hold up a sign that assures passing motorists of our mental competence.', ""Good idea.\nWhy don't you get started on that?""]",False
1_7953.wav,Why don't you ask Scotty to beam you up?,"['Hello.', 'Uh, four glasses of water, please.', 'Anything for you guys?', 'Can I use your phone? \nOur car got stolen.']",True
1_8042.wav,"No, just me, her and a couple of the big wigs. It's part of a bonus she got.","['Here you go.', 'Great. Come on in.', ""What, you don't say thank you?"", ""It's my suitcase.\nI lent it to you two years ago."", 'Well, then, I should tell you I broke the wheel and the handle.', ""So, is everyone from Bernadette's company going to Vegas?""]",False
1_8045.wav,"Dumped her? What, did he use a forklift?","['to rebrand the stuff as a cure for constipation.', 'Way to make lemonade.\nYou know, from around the corner where fudge is made.', 'Hey, I got a favor to ask.', 'Sure.', ""My mom's been kind of an emotional wreck since that dentist she was dating dumped her.""]",True
1_8052.wav,Like Burt and Ernie. You guys even teach me stuff about words and numbers.,"['I swear, that man is the most egotistical, insufferable human being I have ever met.', 'Yeah, but you two make such a cute couple.']",True
1_8078.wav,"Trust me, you're not Jewish. That's how they get you.","['Rajesh!\nYou up?\nYou ready for breakfast?', 'Oh, boy. Breakfast.', 'Okay, Raj, listen to me.\nYou need to get out of there.', 'But I have a cream sherry hangover and I smell blintzes.', ""If you don't leave now, she'll use food and guilt to keep you there for the rest of your life."", 'Oh, Howard, stop.']",False
1_8136.wav,"Yeah, I'm really looking forward to it. In fact, there's no place I would rather be than here.","[""It's nice that all the people who are lonely on Valentine's Day can come here tonight and be together.""]",True
1_8159.wav,And I'm cool with surprises. But nothing on a Jumbotron. I don't want to cry on a big screen like that.,"['But if someday you decide you want to get married, you have to propose to me.', 'Really?', ""Yes. It's all on you."", 'But I got to tell you, when the time comes, I want the whole nine yards.', 'I want you down on one knee, flowers.\nI want to be swept off my feet.', 'Yeah, you got it.']",False
1_8185.wav,We could go to Red Lobster and talk about it. We're all thinking it. I just had the decency to wait for him to leave.,"['The surf and turf sounds good.\nSee if they corn on the cob.', ""Guys!\nWe're trying to get him out of here, not you in."", ""You're wasting your time.\nJust please, leave me alone."", 'Now what?', ""I don't know.""]",False
1_8217.wav,"Go out with me on one date, and I promise you, you'll see.","['There are many things seriously wrong with me.', 'And not quirks, either.\nLike... diagnosable psychological problems.', 'Maybe brain damage.', ""Well, how do I know you're not just saying that?""]",False
1_8407.wav,"Oh, sure, what a wonderful idea. And after that, I'll make up my own rules of oral hygiene. You know, instead of flossing, I'll rub pudding on my gums. I'm going to get the number of the SyFy Channel and give them what for.","['It ended on a cliffhanger.', 'They did.', 'Uh, Sheldon, there are two dumplings left. Do you want them?', ""Dumplings?\nDon't you understand what's going on here?"", 'As a rule, no.', ""That show ended with all the residents of New York either dead or unconscious.\nNow I'll never know what happened."", ""Well, why don't you make up your own ending?""]",True
1_8417.wav,"Oh, I think we were looking at creepy in the rearview mirror when I put up that camera.","['Roger is Raj.', 'I always thought, if I had a white name, it would be Gavin.', 'Keep reading. What does it say?', ""No, no, I don't know if I should. \nIf she wanted me to know about her blog, she would've told me."", ""It's almost like I'm reading her diary."", ""That's exactly what it's like. Keep reading."", 'No, this is creepy.']",False
1_8452.wav,I think I'm gonna go. Thank you for the burrito and the pork rinds and the 20-minute lecture on why monster trucks are better than regular trucks.,"[""Probably because I didn't read the instructions.\nNo wrapper's going to tell me what to do."", 'Unless his name is Jay-Z.', 'Is something going on?', 'What do you mean?', ""Well, you're acting all weird.\nAnd I'm pretty weird, so I think I know what I'm talking about."", ""I don't know. Maybe it's all those steroids I've been taking.""]",True
1_8505.wav,"A lane frequented by liars. Like you, you big liar!","['I just Googled ""foo-foo little dogs.""', ""(Skype ringing) It's Raj. Stay quiet."", '(chuckles): Hey!\nBad timing.\nBernadette just took Cinnamon out for a walk.', ""Hmm. Interesting. \nDid they take a walk down Liars' Lane?"", 'What?']",False
1_8717.wav,Because you're in the right lane behind a bus and you won't go around it? I'm sure she finds it charming.,"[""Do you think Penny's mad at me?""]",True
1_8746.wav,"I enjoyed it. When you told me I was going to be ""losing my virginity,"" I didn't think you meant showing me <i>Raiders of the Lost Ark</i> for the first time.","[""So what'd you think?"", 'It was good.', ""That's it?"", '""Good""?']",True
1_8749.wav,It was very entertaining... despite the glaring story problem.,"['I enjoyed it. When you told me I was going to be ""losing my virginity,"" I didn\'t think you meant showing me Raiders of the Lost Ark  for the first time.', 'My apologies. I chose my words poorly.\nI should have said you were about to have your world rocked on my couch.', ""Anyway, thank you for watching it.\nIt's one of my all-time favorites.""]",True
1_8827.wav,How do you not tear off his clothes and take him right here on this table?,"[""Awkward silence. Sheldon on his phone.\nNo touching. Somebody's having date night."", ""It's actually steamier than it looks.\nSheldon's looking up the phallic symbolism of root vegetables in Renaissance paintings."", ""Oh, no, I got bored with that.\nI'm just browsing cuticle scissors on Amazon.""]",True
1_8837.wav,"Not as relieved as I'm about to be. It's a brave new world, little lady.","['Really?', 'Yes.', 'Huh. Yeah, I always took it literally.', ""That's why I have never once moved my bowels in this or any restaurant. \nHmm."", ""I'm relieved that you don't have a problem with us working together.""]",False
1_9003.wav,"I'm not going to bother him, I'm going to talk to him.","['I guess they really do read their mail.', ""Hey, isn't that Professor Proton?"", 'Oh, yeah.', ""Look at him, just standing in line like he wasn't moderately famous 30 years ago."", ""- Let's go say hello."", ""- Oh, maybe we shouldn't bother him.""]",False
1_9009.wav,"- No, no, no. I'm really good at this. All right, give me a hint. Does it involve difficulty initiating a stream of anything?","['Dr. Jeffries, hello again. Leonard Hofstadter.', 'Oh, oh, right, I remember your-your girlfriend.', 'Is-Is she... is she here?', ""No, she's not."", 'So, what prescription are you getting filled?', '- Sheldon.', ""No. Wait, I want to guess. Don't tell me."", ""I wasn't going to tell you.""]",False
1_9087.wav,"Why? Because I got an ugly, itchy sweater, and my brother got a car? No, I was her favorite.","['Yup, oh... here you go.', 'Oh, thank you.', 'Here, get yourself an eraser for your troubles.', 'Oh-ho.\nI forgot about this. \nMy aunt made it for me when I started college.', 'Aw, did she hate you?']",True
1_9245.wav,Can we talk about something else? Do you know that I yodel?,"['Yes.', 'And some people in the science community are calling it ""The Wonder Blunder.""', ""Who? Give me their names.\nI bet it's Wolowitz."", ""It's just such a fascinating story. Your calculations are way off, but they find the element anyway."", ""It's like misreading a treasure map and still finding the treasure.""]",False
1_9594.wav,I can't believe we wasted all that time on our Hulk costumes.,"[""You know, there-there's always WonderCon in Anaheim, you know?"", ""That-That's just as good."", 'Excuse me.', 'Oh, guys, this is really sad.', 'And in a different way than it was 20 minutes ago.']",False
1_9668.wav,"People usually start a meeting with a joke, but you go ahead-- end with one.","[""We'll come back to that one."", ""This brings us to the final item in our annual State of the Relationship Summit.\nItem 29: Valentine's Day."", 'Ah, the worst for last. Hmm.', 'Classic Flakey.', ""Before you get upset, I believe I've come up with a way for us to celebrate the occasion that we both can enjoy.""]",False
1_9963.wav,What do you think I was gonna do at home?,"['Koothrappali murder mystery dinner.', ""I'm leaving."", ""You can't leave. \nYou're a suspect in the mysterious murder of Stuart Bloom."", ""(dramatic music plays) I didn't know his last name was Bloom."", ""Yeah, it's Bloom."", 'Are you really gonna lie on the floor and pretend to be dead all night?']",False
1_9971.wav,I was gonna say we pick up a cake or a pie. But an insult to her faith is always thoughtful.,"[""We can't show up to your mom's empty-handed. \nWe should bring something."", ""I already am.\nI'm bringing the gift of knowledge."", 'Oh, boy.', ""Despite what her Bible says, recent archeological studies indicate that although camels are referenced in the Old Testament, they didn't exist in the Middle East until hundreds of years later.""]",True
1_9972.wav,"Ooh, I'm gonna check the fridge, and see if there are any clues inside a beer.","['So, what happens next?', ""I can't tell you that.\nBut perhaps the killer dropped a fun and imaginative clue somewhere in the apartment.""]",True
1_9993.wav,"Well, my beer isn't flat and my rack's not saggy. So far, the future's great.","[""You're all inside it, and we hurtle through the very fabric of time."", '(electronic sound effects playing) And welcome to 20 years in the future.', 'Hey, you guys just time-traveled.\nStop looking so bored.']",True
